https://www.crunchbase.com//organization/imed-technologies, iMed Technologies ,Venture - Series Unknown,iMed Technologies is developing AI technology based assisting tool for surgical operations of treatment of brain infarction and subarachnoid hemorrhage. Utilizing the state-of-the art AI learning technology and plenty of medical data  iMed Technology develops a real-time assisting product for physicians who engage in surgical operations for brain infarction and/or subarachnoid hemorrhage patients with the mission of providing safer medical services., Artificial Intelligence  Health Care  Machine Learning  Medical  Nursing and Residential Care  Software  Video, Tokyo  Tokyo  Japan,iMed Technologies develops surgery support AI using video analysis to realize safe surgery for cerebral infarction.,58 641,2019,Active,—, — , Asia-Pacific (APAC),—,—,For Profit, imed-tech.co.jp/ ,https://www.facebook.com/iMed-Technologies-498174474052862/,https://www.linkedin.com/company/imed-technologies-inc,—,info@imed-tech.co.jp,—,—, —,—,—, —, —, Artificial Intelligence  Data and Analytics  Health Care  Media and Entertainment  Science and Engineering  Software  Video,2, Kenichi Kono  Motohisa Kaneko,1-10,1,—,Oct 1  2020,¥170 000 000,¥170 000 000,Venture - Series Unknown,¥170 000 000,¥170 000 000, SBI Investment  MITSUI SUMITOMO INSURANCE Venture Capital (MSIVC)  Graduate School of Management  GLOBIS University,—,3,—, —,—,—,—,—,—,—,—,—,—,Private,—,—,—,—,—,—,—,—,—,8, — ,—,—,—,—,—,—,—,—,—,—,—,2,—,—,—,—,—,—,—,—,—,—,—,—, —,—,—,—,—,—,—,—,—,59 063,—,-0.1,-0.3,2.6
https://www.crunchbase.com//organization/research-institute-for-computational-science, RICOS Co. Ltd. ,Series A,RICOS is a tech company that optimizes manufacturing processes using AI  simulation  and high-performance computing technologies. RICOS creates an AI algorithm called IsoGCN that is tailored for use with simulation data  allowing for faster and more interactive design and evaluation. RICOS promotes research and development with the goal of realizing a world in which scientific computing technology  including CAE  can be used at manufacturing sites and people's ideals can be realized instantly., 3D Technology  Artificial Intelligence  Machine Learning  Simulation, Tokyo  Tokyo  Japan,RICOS is a tech company that optimizes manufacturing processes using AI  simulation  and high-performance computing technologies.,58 792,Dec 11  2015,Active,—, — , Asia-Pacific (APAC),—,—,For Profit, www.ricos.co.jp/ ,—,https://www.linkedin.com/company/kkricos,https://twitter.com/RICOS_ltd,Johrenk7@gmail.com,—,—, —,—,—, —, —, Artificial Intelligence  Data and Analytics  Hardware  Science and Engineering  Software,1, Yu Ihara,11-50,3,Early Stage Venture,Nov 29  2021,¥2 025 000,¥2 025 000,Series A,¥342 725 000,¥342 725 000, DG Ventures (Digital Garage Group TSE4819)  UTEC - The University of Tokyo Edge Capital Partners,1,2,—, —,—,—,—,—,—,—,—,—,—,Private,—,—,—,—,—,—,—,—,—,7, — ,—,—,—,—,—,—,0,1,—,—,—,43,399,—,0,—,—,1,—,100%,—,6 966 505,—,—, —,—,—,—,—,—,—,—,—,59 217,—,-0.1,1.1,3
https://www.crunchbase.com//organization/revorf, Revorf ,Seed,Revorf is developing a testing business and a diagnostic drug development of support drug discovery and support business in relation to the neo-self theory  which is a new mechanism that explains the basis of autoimmune diseases. The methods are created by combining proprietary gene detection analysis technology  such as RNA  protein information analysis technology  data analysis  and artificial intelligence technology., Artificial Intelligence  Health Care, Tokyo  Tokyo  Japan,Revorf is a medical technology and drug discovery platform.,58 920,Nov 11  2019,Active,—, — , Asia-Pacific (APAC),—,—,For Profit, www.revorf.jp/ ,—,—,—,information@revorf.com,—,—, —,—,—, —, —, Artificial Intelligence  Data and Analytics  Health Care  Science and Engineering  Software,1, Shinichi Sueda,—,1,Seed,Mar 8  2021,¥300 000 000,¥300 000 000,Seed,¥300 000 000,¥300 000 000, Nippon Venture Capital  NOW  i-nest capital  Shinsei Corporate Investment  Mamoru Taniya,2,5,—, —,—,—,—,—,—,—,—,—,—,Private,—,—,—,—,—,—,—,—,—,8, — ,—,—,—,—,—,—,—,—,—,—,—,3,—,—,—,—,—,—,—,—,—,—,—,—, —,—,—,—,—,—,—,—,—,59 348,—,-0.1,1.3,3.7
https://www.crunchbase.com//organization/liberaware, Liberaware ,Venture - Series Unknown,Liberaware is a machine learning and artificial intelligence company., Artificial Intelligence  Drones  Machine Learning  Software, Chiba  Chiba  Japan,Liberaware is a machine learning and artificial intelligence company.,59 046,Jan 1  2016,Active,—, — , Asia-Pacific (APAC),—,—,For Profit, liberaware.co.jp/ ,—,https://in.linkedin.com/company/liberaware,—,—,1-043-497-5740,—, —,—,—, —, —, Artificial Intelligence  Consumer Electronics  Consumer Goods  Data and Analytics  Hardware  Science and Engineering  Software,1, Min Hongyu,11-50,4,—,Apr 30  2020,¥260 000 000,¥260 000 000,Venture - Series Unknown,¥548 000 000,¥548 000 000, A.L.I. Technologies Japan  Drone Fund  Venture Labo Investment  NEC Capital Solutions  Miyako Capital,—,7,—, —,—,—,—,—,—,—,—,—,—,Private,—,—,—,—,—,—,—,—,—,56, — ,—,—,—,—,—,Aircraft; Aviation; Cosmonautics,0,6,—,—,—,5,378,3 730,1 508,-96.73%,561.82%,8.67,766.67%,66.67%,-33.33%,7 005 722,5 394 850,334.9%, —,—,—,—,—,—,—,—,—,59 476,—,-0.2,-0.5,-0.3
https://www.crunchbase.com//organization/ai-samurai, AI Samurai ,Series B,AI Samurai specializes in the development and sales of artificial intelligence technology. It also supports patent research and technical research. The company was founded in 2015., Artificial Intelligence  Information Technology  Legal  Office Administration  Product Research  Task Management, Otemachi  Tokyo  Japan,AI Samurai is a patent examination simulation system that helps solve issues and problems faced by inventors.,60 104,Sep 11  2015,Active,$1M to $10M, — , Asia-Pacific (APAC),—,—,For Profit, aisamurai.co.jp/ ,https://www.facebook.com/shirasakapat,—,https://twitter.com/aisamurai_inc,info@aisamurai.co.jp,03-6270-5577,—, —,—,—, —, —, Administrative Services  Artificial Intelligence  Data and Analytics  Design  Information Technology  Professional Services  Science and Engineering  Software,1, Hajime Shirasaka,11-50,4,Early Stage Venture,Jul 31  2019,¥470 000 000,¥470 000 000,Series B,¥788 000 000,¥788 000 000, SMBC Venture Capital  Mizuho Capital  SPARX Group  Core Corporation  Venture Labo Investment,2,18,—, —,—,—,—,—,—,—,—,—,—,Private,—,—,—,—,—,—,1,—,—,2, — ,—,—,—,—,Legal services,Computing; Calculating,2,18,—,—,—,—,—,—,—,—,—,—,—,—,—,—,—,—, —,—,—,—,—,—,—,—,—,60 541,—,-0.3,-0.7,-0.5
https://www.crunchbase.com//organization/1-10, 1 → 10 ,Venture - Series Unknown,1 → 10 is an IT company that uses AI technology that directs commercial facilities and events to utilize projection mapping and XR. 1 → 10 is an IT company that comprehensively produces everything from discovering issues for companies and brands to solutions  from the services to experience-based entertainment using advanced technologies and the creative field to prototyping products. The company provides products and services including space directing  product development consulting  robotics  video production  brand consulting  web (PC / SP) site production  and branded content production.In addition  1 → 10 consulting  content  and solutions  and data  they continue to create a variety of businesses with the three layers on the vertical axis. It also offers a solution in AI consulting & robotics development  communication strategy & creative development  spatial entertainment creation  and IoT product consulting & development.1 → 10 was founded in October 1997 and is based in Kyoto  Japan., Artificial Intelligence  Consulting  Information Services  Information Technology  Internet of Things  Software, Kyoto  Kyoto  Japan,1 → 10 is an IT company that uses AI technology that directs commercial facilities and events to utilize projection mapping and XR,60 338,Oct 1997,Active,—, — , Asia-Pacific (APAC),—,—,For Profit, www.1-10.com/ ,https://www.facebook.com/onetoten.inc,—,https://www.twitter.com/onetoten_inc,pr@1-10.com,+81 75-371-2017,—, —,—,—, —, —, Artificial Intelligence  Data and Analytics  Information Technology  Internet Services  Professional Services  Science and Engineering  Software,2, Yoshiaki Sawabe  Yoshiaki Sawabe,101-250,1,—,Nov 7  2016,¥450 000 000,¥450 000 000,Venture - Series Unknown,¥450 000 000,¥450 000 000, JAFCO,1,1,—, —,—,—,—,—,—,—,—,—,—,Private,—,—,—,—,—,—,—,—,—,8, — ,—,—,—,—,—,—,—,—,—,—,—,42,—,—,—,—,—,—,—,—,—,—,—,—, —,—,—,—,—,—,—,—,—,60 777,—,0.1,2,3.2
https://www.crunchbase.com//organization/aiforce-solutions, Aiforce Solutions ,Series A,Aiforce Solutions is an able to use AI to solve problems in the AI market.The company provides three main services  from the introduction to the improvement of AI. In the first “AI Development Due Diligence”  AI Implementation Consulting  which leads to customer business reform  and support prototype development at 1/3 of the cost of competitors. In addition  we support the selection of AI vendors to conduct PoC and the technical evaluation of potential investment candidates as a member of our customers, Artificial Intelligence  Communications Infrastructure  Human Resources  Machine Learning  Software, Tokyo  Tokyo  Japan,Aiforce Solutions is an able to use AI to solve problems in the AI market.,60 550,Jul 2018,Active,$1M to $10M, — , Asia-Pacific (APAC),—,—,For Profit, www.aiforce.solutions ,—,—,—,info@aiforce.solutions,—,—, —,—,—, —, —, Administrative Services  Artificial Intelligence  Data and Analytics  Hardware  Science and Engineering  Software,1, Mikoda Tatsuo,1-10,2,Early Stage Venture,Sep 14  2020,¥260 000 000,¥260 000 000,Series A,¥299 794 938,¥299 794 938, Sumitomo  Mizuho Capital  DBJ Capital  77 Capital  Gordon Brothers Japan,2,5,—, —,—,—,—,—,—,—,—,—,—,Private,—,—,—,—,—,—,—,—,—,5, — ,—,—,—,—,—,—,—,—,—,—,—,7,—,—,—,—,—,—,—,—,—,—,—,—, —,—,—,—,—,—,—,—,—,60 992,—,-0.2,-0.1,1.9
https://www.crunchbase.com//organization/lapras, LAPRAS ,Venture - Series Unknown,LAPRAS provides a career-matching platform connecting engineers to companies. Engineers can automatically generate their profiles based on crawling technology and machine learning analysis. Technical information and orientation are objectively analyzed and provided as a portfolio with LAPRAS  so no additional burden or preparation is required. LAPRAS uses machine learning to objectively analyze skills and preferences. Their data is gathered from various sources  including technical information-sharing services and social networking sites., Artificial Intelligence  Career Planning  Recruiting, Tokyo  Tokyo  Japan,LAPRAS provides a career-matching platform connecting engineers to companies.,60 666,May 11  2016,Active,—, — , Asia-Pacific (APAC),—,—,For Profit, lapras.com/ ,https://www.facebook.com/scouty.inc/,https://www.linkedin.com/company/lapras-inc,https://twitter.com/scouty_inc,—,—,1, —,—,—, —, —, Artificial Intelligence  Data and Analytics  Professional Services  Science and Engineering  Software,3, Hiroki Shimada  Katsutoshi Ito  Yudai Nii,11-50,3,—,Sep 14  2020,¥350 000 000,¥350 000 000,Venture - Series Unknown,$6 890 269,$6 890 269, Headline Asia (formerly Infinity Ventures)  Future Venture Capital  Will Group  Yusuke Sato  X Capital,2,6,—, —,—,—,—,—,—,—,—,—,—,Private,—,—,—,—,—,—,—,—,—,9, — ,—,—,—,—,—,—,—,—,—,—,—,96,57 365,46 545.67,23,-26.58%,-67.61%,1.55,-8.94%,58.87%,-15.6%,607 206,180 144,42.18%, —,—,—,—,—,—,—,—,—,61 112,—,-0.1,-0.4,-0.1
https://www.crunchbase.com//organization/lisse, Lisse ,Venture - Series Unknown,Lisse is a legal technology firm that offers a contract review support AI solution. Lisse's solution allows for 24-hour contract checking. Lisse's products include the LeCHECK service  which uses AI to support contract checking and creation  and the LeTRANSLATE tool  which performs high-quality machine translation of English contracts in real-time. With the knowledge of professional lawyers and the power of legal technology  Lisse is on a mission to improve the legal affairs of all companies  reduce the risks inherent in transactions  and realize a smooth society with few disputes., Artificial Intelligence  Legal, Sarugaku  Tokyo  Japan,Lisse offers legal business innovation through the use of AI.,60 789,Jun 1  2018,Active,—, — , Asia-Pacific (APAC),—,—,For Profit, lisse-law.com/ ,—,—,https://twitter.com/lisselaw,info@lisse-law.co,03-5789-5290,1, —,—,—, —, —, Artificial Intelligence  Data and Analytics  Professional Services  Science and Engineering  Software,1, Miki Fujita,1-10,3,—,Nov 24  2021,¥550 000 000,¥550 000 000,Venture - Series Unknown,¥765 700 000,¥765 700 000, Money Forward  Global Brain Corporation  Daiwa Corporate Investment  Miroku Information Service  Deep30,3,5,—, —,—,—,—,—,—,—,—,—,—,Private,—,—,—,—,—,—,—,—,—,—, — ,—,—,—,—,—,—,—,—,—,—,—,11,6 086,5 268.67,0,-22.13%,—,1,-20.68%,100%,35.26%,2 451 850,428 879,21.2%, —,—,—,—,—,—,—,—,—,61 238,—,-0.4,2.6,4.7
https://www.crunchbase.com//organization/edgematrix, Edgematrix ,Series B,"EDGEMATRIX is a startup spun out from the AI ​​project team of a global venture company and provides ""Edge AI Box""  ""Edge AI platform"" and ""Edge AI Solutions"".", Artificial Intelligence  GPU  Internet of Things  Software, Tokyo  Tokyo  Japan,Edgematrix develops fundamental technology of edge AI for processing real-time video data and provides it as a platform service.,61 363,Apr 26  2019,Active,—, — , Asia-Pacific (APAC),—,—,For Profit, edgematrix.com/ ,https://www.facebook.com/EDGEMATRIX.INC/,https://www.linkedin.com/company/edgematrix-inc,—,info@edgematrix.com,1-136-416-5861,1, —,—,—, —, —, Artificial Intelligence  Data and Analytics  Hardware  Internet Services  Science and Engineering  Software,2, Hiroshi Ohta  Shinya Motohashi,11-50,3,Early Stage Venture,Mar 18  2021,¥1 000 000 000,¥1 000 000 000,Series B,¥1 900 000 000,¥1 900 000 000, NTT DoCoMo  Sony Innovation Fund  DG Ventures (Digital Garage Group TSE4819)  Cloudian Holdings  Shimizu Corporation,3,8,—, —,—,—,—,—,—,—,—,—,—,Private,—,—,—,—,—,—,—,—,—,5, — ,—,—,—,—,Scientific and electric apparatus and instruments,—,1,0,—,—,—,39,717,1 913.67,10,528.95%,-62.96%,2,-33.33%,0%,0%,5 787 753,-2 309 519,-28.52%, Operations,2,—,—,—,—,—,—,—,61 818,—,-0.3,-0.6,-0.3
https://www.crunchbase.com//organization/valuenex, Valuenex Japan ,Post-IPO Equity,Valuenex Japan is a big data  predictive analytics and consulting services company  powered by proprietary algorithms  artificial intelligence  and teams of data scientists and expert analysts. Their services include intellectual property  R&D strategy  big data  machine learning  consulting  patent analysis  and data visualization., Analytics  Artificial Intelligence  Consulting  Information Technology  Machine Learning, Tokyo  Tokyo  Japan,Valuenex Japan is an intellectual innovator business that transforms large volumes of data into visualization graphics.,61 644,Aug 1  2006,Active,$1M to $10M, — , Asia-Pacific (APAC),Oct 30  2018,—,For Profit, en.valuenex.com ,https://www.facebook.com/VALUENEX株式会社-205187276338669/,https://www.linkedin.com/company/valuenex-inc.,https://twitter.com/valuenex,customer@valuenex.com,+81 3 6902 9833,—, —,—,—, —, —, Artificial Intelligence  Data and Analytics  Information Technology  Professional Services  Science and Engineering  Software,1, Tatsuo Nakamura,11-50,3,IPO,Aug 10  2023,$400 000,$400 000,Post-IPO Equity,$400 000,$400 000, WERU Investment  WM Partners,2,2,—, —,—,—,—,—,—,—,—,—,—,Public,Oct 30  2018,—,—,¥10 559 139 000, 4422 ,TYO - Tokyo Stock Exchange,—,—,—,10, — ,—,—,—,—,Advertising; business,—,1,0,—,—,—,2,—,—,—,—,—,—,—,—,—,—,—,—, —,—,—,—,—,—,—,—,—,62 102,—,-0.4,-0.2,8.5
https://www.crunchbase.com//organization/quantumcore, QuantumCore ,Series A,QuantumCore develops reservoir computing solutions  including a multivariate time-series processing solution exceeding the performance of deep learning by diversion of technology in the field of quantum computing., Internet  Machine Learning, Tokyo  Tokyo  Japan,QuantumCore develops reservoir computing solutions  including a multivariate time-series processing solution.,61 865,Apr 24  2018,Active,—, — , Asia-Pacific (APAC),—,—,For Profit, www.qcore.co.jp/ ,https://www.facebook.com/BEQuantumCore-240196876673691/,https://www.linkedin.com/company/quantum-core,https://twitter.com/qcore_info,—,—,1, —,—,—, —, —, Artificial Intelligence  Data and Analytics  Internet Services  Software,1, Akiyoshi Shingo,1-10,2,Early Stage Venture,Jul 1  2019,¥160 000 000,¥160 000 000,Series A,¥200 000 000,¥200 000 000, JAFCO  IDATEN Ventures,1,2,—, —,—,—,—,—,—,—,—,—,—,Private,—,—,—,—,—,—,—,—,—,6, — ,—,—,—,—,—,—,—,—,—,—,—,37,—,—,—,—,—,—,—,—,—,—,—,—, —,—,—,—,—,—,—,—,—,62 325,—,-0.3,-0.4,4.4
https://www.crunchbase.com//organization/nishika, Nishika ,Seed,Nishika provides data science competitions  Q&A  and recruitment platforms. Nishika provides AI model development with a high level of difficulty; however  it is also possible to use a method known as data analysis competition  which enables model development at the highest level in Japan. Nishika recruits top-tier AI and data analysis talent who are constantly honing their skills through data analysis competitions. It offers Nishika Connect  a direct recruiting service with a complete performance fee type that can connect you with excellent human resources who are proficient in Python  R  and SQL., Analytics  Artificial Intelligence  Career Planning  Employment  Human Resources  Q&A  Recruiting  Social Media, Tokyo  Tokyo  Japan,Nishika provides a data science competitions  Q&A  and recruitment platform.,62 820,May 7  2019,Active,—, — , Asia-Pacific (APAC),—,—,For Profit, www.nishika.com ,https://www.facebook.com/nishika0507/,https://www.linkedin.com/company/nishika,https://twitter.com/Nishika0507,info@nishika.com,—,—, —,—,—, —, —, Administrative Services  Artificial Intelligence  Community and Lifestyle  Data and Analytics  Internet Services  Media and Entertainment  Professional Services  Science and Engineering  Software,2, Matsuda Hiroyuki  Yamashita Dalang,1-10,1,Seed,Nov 13  2020,¥83 000 000,¥83 000 000,Seed,¥83 000 000,¥83 000 000, CyberAgent Capital  G-STARTUP  Hajime Hotta,—,3,—, —,—,—,—,—,—,—,—,—,—,Private,—,—,—,—,—,—,—,—,—,10, — ,—,—,—,—,—,—,—,—,—,—,—,64,289 152,86 353.17,1 009,38.96%,-55.59%,2.47,-30.99%,25%,28.4%,180 063,-24 645,-12.04%, —,—,—,—,—,—,—,—,—,63 287,—,1.9,2.4,3.5
https://www.crunchbase.com//organization/lang, Lang-8 ,Venture - Series Unknown,"Lang-8 is a language exchange website Native speakers will help you correct journal entries in the language that you're learning  and you can do the same to help them out as well. If you're learning another language  whether you are a beginner  intermediate  or advanced  there is no better way than interacting with native speakers of the language that you're learning. Here's how Lang-8 works.1) Write Journal Entries in the Language that You're Learning: Lang-8 makes it easy to write entries  reviews  and more in the language that you're learning. It's a great way to get better quickly.2) Native Speakers Correct Your Entries: Whenever you write something new  native speakers come in and correct your entries. Corrections are easy to see and understand so you can learn as much as possible.3) Help Others:The Lang-8 community is super-friendly. Come join us and see for yourself!More than 70 languages are available in Lang-8.We have users from 180 Countries.", E-Learning  Education  Language Learning  Natural Language Processing, Kyoto-shi  Kyoto  Japan,language learning community site,62 835,Jun 28  2007,Active,Less than $1M, — , Asia-Pacific (APAC),—,—,For Profit, lang-8.com ,http://www.facebook.com/lang8,https://www.linkedin.com/company/lang-8-inc.,http://twitter.com/lang8,info@lang-8.jp,815058065557,1, —,—,—, —, —, Artificial Intelligence  Data and Analytics  Education  Software,2, Ki Yoyo  Yangyang Xi,51-100,4,—,Sep 25  2018,¥650 000 000,¥650 000 000,Venture - Series Unknown,$7 853 902,$7 853 902, DBS Bank  East Ventures  CyberAgent Capital  DeNA  Nippon Venture Capital,—,17,—, —,—,—,—,—,—,—,—,—,—,Private,—,—,—,—,—,—,—,—,—,8, — ,—,—,—,—,Scientific and electric apparatus and instruments,—,2,0,7,5 135,1,22,96 262,140 823.83,2 610,-33.33%,183.39%,1.87,-49.71%,60.19%,2.42%,413 195,143 813,53.39%, —,—,—,—,—,—,—,—,—,63 302,—,0.7,1.2,1.3
https://www.crunchbase.com//organization/ashita-team, ASHITA-TEAM ,Venture - Series Unknown,ASHITA-TEAM operates an HR assessment cloud utilizing AI that aims to support working-style reform. The service is characterized by consistent support from the analysis of the current state of the company  the construction of the evaluation system  the implementation of the evaluation system  and the development of the personnel assessment system in 1 month to 3 months. The service is valued for its extensive operational support and the convenience of evaluation cloud  and has a performance of introducing more than 1300 companies.ASHITA-TEAM was founded in 2008 and is based in Tokyo  Jpan. In addition  the company has expanded its offices in Taiwan  Singapore  Shanghai  Hong Kong and overseas  and is expected to grow dramatically in the future., Artificial Intelligence  Career Planning  Employment  Human Resources  SaaS  Task Management, Tokyo  Tokyo  Japan,ASHITA-TEAM operates an HR assessment cloud utilizing AI that aims to support working-style reform.,63 090,Sep 25  2008,Active,—, — , Asia-Pacific (APAC),Jul 19  2018,—,For Profit, www.ashita-team.com/ ,https://www.facebook.com/ashita.team/,https://www.linkedin.com/company/ashitateamhk/,https://twitter.com/ashitanoteam,—,03-4577-3923,—, —,—,—, —, —, Administrative Services  Artificial Intelligence  Data and Analytics  Professional Services  Science and Engineering  Software,1, Kyosuke Takahashi,1-10,3,M&A,Feb 28  2020,¥135 000 000,¥135 000 000,Venture - Series Unknown,¥835 000 000,¥835 000 000, Future Venture Capital  Chiba Bank  Toho Bank  Iyo Bank Capital  Senshu Ikeda Capital,—,7,—, Was Acquired,—,—,—,—,—,—,—,—,—,Private,—,—,—,—,—,—,—,—,—,6, — ,—,—,—,—,—,Computing; Calculating,0,1,19,—,—,76,328 517,315 650.83,1 403,12.97%,916.67%,1.46,36.56%,80.56%,-16.45%,163 687,4 354,2.73%, —,—,—, ASHITA-TEAM acquired by Vector , Vector ,Jul 19  2018,—,Acquisition,—,63 561,—,0,0,-0.1
https://www.crunchbase.com//organization/hutzper, Hutzper ,Seed,"Hutzper provides edge AI for small and medium-sized businesses. Edge AI ""Phoenix Vision "" which serves as the company's eyes  and a system (SaaS) that provides continuous support after the introduction of AI ""Phoenix Insight "" are being introduced primarily for the automation of inspection and inspection processes at manufacturing sites in the Kansai area.", Artificial Intelligence  Image Recognition  Machine Learning  Manufacturing, Osaka  Osaka  Japan,Hutzper is a computing solution for the manufacturing industry specialized in image recognition and AI development.,63 591,Apr 1  2020,Active,—, — , Asia-Pacific (APAC),—,—,For Profit, hutzper.com ,https://www.facebook.com/profile.php?id=100045411763650,https://www.linkedin.com/company/hutzper,https://twitter.com/hutzper,info@hutzper.com,050-5832-6617,—, —,—,—, —, —, Artificial Intelligence  Data and Analytics  Manufacturing  Science and Engineering  Software,3, Hiro Onishi  Kazuki Yumiba  Kota Kurose,1-10,2,Seed,Jan 20  2021,¥100 000 000,¥100 000 000,Seed,¥100 000 000,¥100 000 000, East Ventures  ANRI  Globe Advisors  Hiroshima Venture Capital  CHUGIN LEASE,1,5,—, —,—,—,—,—,—,—,—,—,—,Private,—,—,—,—,—,—,—,—,—,12, — ,—,—,—,—,—,Separating Solids From Solids,0,1,—,—,—,7,695,—,72,69 400%,—,2.24,124.32%,0%,—,5 857 629,-2 659 199,-31.22%, —,—,—,—,—,—,—,—,—,64 070,—,-0.2,-0.2,-0.2
