https://www.crunchbase.com//organization/gva-tech-japan, GVA TECH Japan ,Seed,GVA TECH is a development and provision of AI-CON series many of the current Legal Services are highly specialized and cost more in proportion to difficulty.This makes it difficult for startups  freelancers  and the general public to get Legal Service right after they start a business., Artificial Intelligence  Task Management, Tokyo  Tokyo  Japan,GVA TECH is a development and provision of AI-CON series many of the current Legal Services are highly specialized.,109 261,Jan 4  2017,Active,—, — , Asia-Pacific (APAC),—,—,For Profit, gvatech.co.jp/ ,—,—,—,contact@gvatech.co.jp,03-6274-8260,—, —,—,—, —, —, Artificial Intelligence  Data and Analytics  Science and Engineering  Software,1, Yamamoto Shun,1-10,2,Seed,Jun 29  2020,¥300 000 000,¥300 000 000,Seed,¥480 000 000,¥480 000 000, Salesforce Ventures  DBJ Capital  Seibu Shinkin Capital,1,3,—, —,—,—,—,—,—,—,—,—,—,Private,—,—,—,—,—,—,—,—,—,4, — ,—,—,—,—,—,—,—,—,—,—,—,15,—,—,—,—,—,—,—,—,—,—,—,—, —,—,—,—,—,—,—,—,—,110 529,—,-0.2,-0.6,0
https://www.crunchbase.com//organization/ai-project, AI Project ,Corporate Round,AI Project provides its clients with security system services by making full use of information technology. It offers a system called Tsutamon in which time information is recorded when a child with an IC tag passes the school gate. It also notifies the parents of the information by email for free. It also manages time information at school and watches child safety by cooperation with the security camera. Also  its system called Koko Yan manages the location information of children with beacon tags and can check them with a PC or smartphone. Other services offered by the company include vehicle position information management system  and System and software development., Artificial Intelligence  Education  Information Technology  Security, Sapporo  Hokkaido  Japan,AI Project provides its clients with security system services.,111 387,Sep 17  2008,Active,$1M to $10M, — , Asia-Pacific (APAC),—,—,For Profit, www.ai-p.co.jp/ ,—,—,—,—,06-6210-3555,—, —,—,—, —, —, Artificial Intelligence  Data and Analytics  Education  Information Technology  Privacy and Security  Science and Engineering  Software,—, — ,—,1,—,Oct 25  2018,¥8 000 000,¥8 000 000,Corporate Round,¥8 000 000,¥8 000 000, SymEnergy,1,1,—, —,—,—,—,—,—,—,—,—,—,Private,—,—,—,—,—,—,—,—,—,4, — ,—,—,—,—,—,—,—,—,—,—,1,7,—,—,—,—,—,—,—,—,—,—,—,—, —,—,—,—,—,—,—,—,—,112 698,—,0.1,0.2,0
https://www.crunchbase.com//organization/anap-lab, ANAP Lab ,Pre-Seed,—, Artificial Intelligence  Fashion  Machine Learning, Tokyo  Tokyo  Japan,ANAP Lab provides machine learning  IoT  AI  and AR / VR technologies for fashion industry.,111 918,Sep 1  2017,Active,$1M to $10M, — , Asia-Pacific (APAC),—,—,For Profit, anaplab.com ,—,—,—,info@anaplab.com,—,—, —,—,—, —, —, Artificial Intelligence  Clothing and Apparel  Data and Analytics  Design  Science and Engineering  Software,—, — ,1001-5000,1,Seed,May 21  2018,¥20 000 000,¥20 000 000,Pre-Seed,¥20 000 000,¥20 000 000, STITCH Japan  Graphnetwork  Yuki Yamamoto  Hiroshi Fuse  Shinnosuke Kawakami,—,5,—, —,—,—,—,—,—,—,—,—,—,Private,—,—,—,—,—,—,—,—,—,4, — ,—,—,—,—,—,—,—,—,—,—,—,4,—,—,—,—,—,—,—,—,—,—,—,—, —,—,—,—,—,—,—,—,—,113 247,—,-0.1,0.7,2.6
https://www.crunchbase.com//organization/device-lab, Device Lab ,Seed,Device Lab develops noise measurement systems for cryogenic electronics. That product includes an entrope noise probe. They provide measurement  contracted research  and consulting services., Predictive Analytics, Tsukuba  Ibaraki  Japan,Device Lab provides noise measurement systems.,112 040,Apr 3  2017,Active,—, — , Asia-Pacific (APAC),—,—,For Profit, www.devicelab.co.jp/ ,—,—,—,—,—,—, —,—,—, —, —, Artificial Intelligence  Data and Analytics  Software,1, Kenji Ohmori,51-100,1,Seed,May 23  2017,¥40 000 000,¥40 000 000,Seed,¥40 000 000,¥40 000 000, Japan Finance,1,1,—, —,—,—,—,—,—,—,—,—,—,Private,—,—,—,—,—,—,—,—,—,6, — ,—,—,—,—,—,—,—,—,—,—,—,—,—,—,—,—,—,—,—,—,—,—,—,—, —,—,—,—,—,—,—,—,—,113 372,—,-0.2,-0.1,-0.4
https://www.crunchbase.com//organization/palsbots, Palsbots ,Product Crowdfunding,Palsbots is a robot software company that imagines the future of the robot society through the development of robot applications and interactive services., Artificial Intelligence  Robotics  SNS  Software, Tokyo  Tokyo  Japan,Palsbots is  a robort software specialists company.,113 637,Jul 2015,Active,—, — , Asia-Pacific (APAC),—,—,For Profit, palsbots.net ,https://www.facebook.com/palsbots,—,https://twitter.com/palsbots,—,03-6407-8852,—, —,—,—, —, —, Artificial Intelligence  Data and Analytics  Hardware  Science and Engineering  Software,1, Mima Naoki,101-250,2,—,Dec 10  2018,¥2 905 000,¥120 000 000,Venture - Series Unknown,¥120 000 000,¥122 905 000, Makuake  VOYAGE VENTURES  Members Japan  NSD  Digital Information Technologies,1,6,—, —,—,—,—,—,—,—,—,—,—,Private,—,—,—,—,—,—,—,—,—,2, — ,—,—,—,—,—,—,—,—,—,—,1,7,—,—,—,—,—,—,—,—,—,—,—,—, —,—,—,—,—,—,—,—,—,115 008,—,-0.1,-0.2,0.4
https://www.crunchbase.com//organization/vanddd, VANDDD ,Corporate Round,VANDDD is a M & A deal maker business;M & A information service business;Value calculation business using artificial intelligence., Artificial Intelligence  Information Technology, Tokyo  Tokyo  Japan,VANDDD is a M & A deal maker business;M & A information service business;Value calculation business using artificial intelligence.,122 691,Mar 16  2018,Active,—, — , Asia-Pacific (APAC),—,—,For Profit, vanddd.com ,https://www.facebook.com/VANDDD.Inc,—,—,—,—,—, —,—,—, —, —, Artificial Intelligence  Data and Analytics  Information Technology  Science and Engineering  Software,1, Abe Ryoma,1-10,2,—,Jul 2  2019,—,—,Corporate Round,¥25 000 000,¥25 000 000, Fundinno  Fukoku Bussan,2,2,—, —,—,—,—,—,—,—,—,—,—,Private,—,—,—,—,—,—,—,—,—,4, — ,—,—,—,—,—,Computing; Calculating,0,1,—,—,—,30,494,—,0,—,—,1,—,100%,—,6 350 203,—,—, —,—,—,—,—,—,—,—,—,124 280,—,-0.1,1.8,0.5
https://www.crunchbase.com//organization/plen-robotics, PLEN Robotics ,Corporate Round,PLEN Robotics is to create robots that enrich the lives of all people regardless of age  gender  nationality  or location.To that end  PLEN Robotics constantly strive to be open-minded and to incorporate new technologies and values without being bound to ideas  cultures  titles  or organizations., Artificial Intelligence  Computer  Facial Recognition  Hardware  Image Recognition  Internet of Things  Manufacturing  Robotics, Osaka-shi  Osaka  Japan,PLEN Robotics creates robots that can access various services by using the customer's or user's face as a key.,125 336,Jun 19  2017,Active,—, — , Asia-Pacific (APAC),—,—,For Profit, www.plenrobotics.com/ ,https://www.facebook.com/plenrobotics,https://www.linkedin.com/company/plen-robotics/,https://twitter.com/plenrobotics,info@plenrobotics.com,1-164-256-6630,—, —,—,—, —, —, Artificial Intelligence  Consumer Electronics  Data and Analytics  Hardware  Internet Services  Manufacturing  Science and Engineering  Software,1, Natsuo Akazawa,1-10,1,—,Nov 27  2017,¥10 005 000,¥10 005 000,Corporate Round,¥10 005 000,¥10 005 000, ABBALab - Atom to Bit  Bit to Atom,1,1,—, —,—,—,—,—,—,—,—,—,—,Private,—,—,—,—,—,—,—,—,—,6, — ,—,—,—,—,—,—,—,—,—,—,1,—,—,—,—,—,—,—,—,—,—,—,—,—, —,—,—,—,—,—,—,—,—,126 987,—,0.3,-0.3,-0.2
https://www.crunchbase.com//organization/softbank-capital, SoftBank Capital ,—,"SoftBank Group provides venture funding and strategic support to exceptional entrepreneurs building disruptive enduring businesses. They are a small team of experienced entrepreneurs and investors who take an ""active"" approach to helping their companies reach their full potential. They manage $600 million across three funds and invest across a company’s lifecycle  from early to growth stages.  Through their close ties to a number of Asia’s leading mobile  internet and technology companies – including strategic partners SoftBank Corp  Yahoo! Japan and Alibaba Group – SoftBank Capital offers unique expertise to businesses seeking to address the Asian market.  Since 1995  SoftBank Capital has partnered with internet pioneers such as Criteo  Gilt Groupe  OMGPOP (Zynga)  betaworks  BuzzFeed  Buddy Media (Salesforce.com)  Huffington Post (AOL)  Associated Content (Yahoo!)  Danger (Microsoft)  Geocities (Yahoo!)  E*Trade and Yahoo!.", Artificial Intelligence  Finance  Financial Services  FinTech  Information Technology  Mobile  Software, Tokyo  Tokyo  Japan,SoftBank Group is a holding company focused on artificial intelligence and other emerging technologies.,129 091,1981,Active,$50M to $100M, — , Asia-Pacific (APAC),Feb 27  2016,—,For Profit, group.softbank ,—,https://www.linkedin.com/company/softbankgroup,https://twitter.com/SoftBank_Group,ContactUs@SoftBank.com,03-6889-2000,427, Crunchbase Venture Program,—,—, Private Equity Firm, Early Stage Venture  Late Stage Venture  Private Equity  Seed, Artificial Intelligence  Data and Analytics  Financial Services  Information Technology  Mobile  Science and Engineering  Software,1, Kiyoshi Ichimura,101-250,—,M&A,—,—,—,—,—,—, — ,—,—,—, Was Acquired,207,301,114,41,125,125,—,—,—,Private,—,—,—,—,—,—,—,Jan 28  2022,—,19, — ,—,—,—,—,—,—,—,—,—,—,—,33,—,—,—,—,—,—,—,—,—,—,—,—, Finance  Legal  Marketing  Product,4,—, SoftBank Capital acquired by Foxconn Technology Group , Foxconn Technology Group ,Feb 27  2016,$600 000 000,Acquisition,—,130 819,—,-0.1,6.3,6.4
https://www.crunchbase.com//organization/deepcore, Deepcore ,—,DEEPCORE is an AI specialized incubator that trains challengers with the will to change the world with technology as entrepreneurs.DEEPCORE will provide an open R&D environment by establishing an advanced co-working space in Hongo  Bunkyo-ku  Tokyo and preparing an AI computing platform  including GPUs with the cooperation of NVIDIA.DEEPCORE will provide opportunities for members to solve social issues by utilizing the latest Deep Learning and other technologies through joint demonstration experiments with companies. Utilizing its position as a member of the SoftBank Group  DEEPCORE will make industry connections  manage projects and offer other forms of support., Artificial Intelligence  Incubators, Tokyo  Tokyo  Japan,DEEPCORE is an AI specialized incubator that trains challengers with the will to change the world with technology as entrepreneurs.,129 420,2005,Active,$1M to $10M, — , Asia-Pacific (APAC),—,—,For Profit, deepcore.jp/ ,https://www.facebook.com/DEEPCOREinc/,—,https://twitter.com/deepcore_inc,—,—,6, —,—,—, Incubator, —, Artificial Intelligence  Data and Analytics  Financial Services  Lending and Investments  Science and Engineering  Software,1, Yutaka Matsuo,11-50,—,—,—,—,—,—,—,—, — ,—,—,—, —,50,63,13,1,1,1,—,—,—,Private,—,—,—,—,—,—,—,—,—,1, — ,—,—,—,—,—,—,—,—,—,—,—,7,15 781,4 434.5,14,14 117.12%,-94.35%,1.51,-24.55%,49.1%,0%,1 449 930,-6 662 709,-82.13%, —,—,—,—,—,—,—,—,—,131 154,—,-0.2,2.9,4.1
https://www.crunchbase.com//organization/predixt, PrediXT ,Seed,—, Information Services  Information Technology  Predictive Analytics, Kyoto  Kyoto  Japan,PrediXT is a developer of prediction technologies.,130 394,Apr 28  2016,Active,—, — , Asia-Pacific (APAC),—,—,For Profit, predixt.ai/ ,—,https://www.linkedin.com/company/predixt/,—,—,—,—, —,—,—, —, —, Artificial Intelligence  Data and Analytics  Information Technology  Software,1, Tadashi Takiguchi,—,1,Seed,Dec 28  2016,¥100 000 000,¥100 000 000,Seed,¥100 000 000,¥100 000 000, Kyoto University Innovation Capital  WERU Investment,—,2,—, —,—,—,—,—,—,—,—,—,—,Private,—,—,—,—,—,—,—,—,—,7, — ,—,—,—,—,—,—,—,—,—,—,—,—,—,—,—,—,—,—,—,—,—,—,—,—, —,—,—,—,—,—,—,—,—,132 147,—,1,0.6,0.5
https://www.crunchbase.com//organization/digital-attendant, DIGITAL ATTENDANT ,Equity Crowdfunding,DIGITAL ATTENDANT is an AI venture founded with the vision of reducing the benefits of AI technology., Artificial Intelligence  Information Services  Information Technology  Intelligent Systems, Tokyo  Tokyo  Japan,DIGITAL ATTENDANT is an AI venture founded with the vision of reducing the benefits of AI technology.,130 919,Jul 2  2014,Active,$1M to $10M, — , Asia-Pacific (APAC),—,—,For Profit, digitalattendant.co.jp ,https://www.facebook.com/digitalattendant0702,—,—,—,—,—, —,—,—, —, —, Artificial Intelligence  Data and Analytics  Information Technology  Science and Engineering  Software,—, — ,1-10,1,—,Jul 31  2018,¥50 000 000,¥50 000 000,Equity Crowdfunding,¥50 000 000,¥50 000 000, Fundinno,1,1,—, —,—,—,—,—,—,—,—,—,—,Private,—,—,—,—,—,—,—,—,—,4, — ,—,—,—,—,—,—,—,—,—,—,—,31,—,—,—,—,—,—,—,—,—,—,—,—, —,—,—,—,—,—,—,—,—,132 690,—,-0.1,-0.1,-0.1
https://www.crunchbase.com//organization/bisuhealth, Bisu ,Convertible Note,Bisu is addressing the $47tn global longevity crisis by helping people live healthy  productive lives for longer. We provide affordable access to actionable health data at home  through easy  accurate urine and saliva tests. We enable personalized nutrition and lifestyle advice through proprietary microfluidic technology and scientific machine learning. Bisu is a graduate of the HAX accelerator and is backed by investors including SOSV  the world's leading health tech investor  and leading sports brand ASICS., Advice  Big Data  Fitness  Health Care  Home Health Care  Internet of Things  Lifestyle  Machine Learning  Personal Health  Wellness, Tokyo  Tokyo  Japan,Enabling affordable access to actionable health data at home  through easy  accurate urine and saliva tests.,134 909,Mar 30  2015,Active,—, — , Asia-Pacific (APAC),—,—,For Profit, www.bisu.com ,https://www.facebook.com/bisuhealth,https://www.linkedin.com/company/bisu,https://www.twitter.com/bisuhealth,daniel@bisu.com,—,2, —,—,—, —, —, Artificial Intelligence  Community and Lifestyle  Data and Analytics  Health Care  Internet Services  Media and Entertainment  Software  Sports,3, Daniel Maggs  Eli Lyons  Wojciech Bula,1-10,7,Seed,Nov 11  2022,$550 000,$3 300 000,Seed,$3 630 000,$4 860 000, SOSV  HAX  ASICS Ventures Corporation  15th Rock  QUAD Investment Management,2,7,—, —,—,—,—,—,—,—,—,—,—,Private,—,—,—,—,—,—,1,—,—,7, — ,—,—,—,—,—,—,—,—,8,—,—,12,—,—,—,—,—,—,—,—,—,—,—,—, Operations,1,—,—,—,—,—,—,—,136 774,—,0,0.4,-0.1
https://www.crunchbase.com//organization/woven-planet-holdings, Woven Planet ,—,Woven Planet Holdings develops technologies designed to achieve zero casualties and provide mobility for all. It has two operating companies  Woven Core  Inc. and Woven Alpha  Inc. along with an investment fund  Woven Capital under it. It uses artificial intelligence integrated with advanced engineering and human-centric interface design to build the mobility of the future.The company was founded in 2021 and is based in Chuo-ku  Tokyo., Artificial Intelligence  Automotive  Autonomous Vehicles  Software, Chuo  Hokkaido  Japan,Woven Planet develops technologies designed to achieve zero casualties and provide mobility for all.,135 956,2021,Active,—, — , Asia-Pacific (APAC),—,—,For Profit, www.woven-planet.global/ ,https://www.facebook.com/WovenPlanet.GL/,https://www.linkedin.com/company/woven-planet-holdings/,https://twitter.com/WovenPlanet_GL,contact@woven-planet.global,—,8, —,—,1, —, —, Artificial Intelligence  Data and Analytics  Science and Engineering  Software  Transportation,1, James Kuffner,501-1000,—,—,—,—,—,—,—,—, — ,—,—,3, Made Acquisitions,—,—,—,—,—,—,—,—,—,Private,—,—,—,—,—,—,—,—,—,11, — ,—,—,—,—,Transport  packaging and storing,Controlling,13,0,11,—,—,—,—,—,—,—,—,—,—,—,—,—,—,—, Product,1,—,—,—,—,—,—,—,137 841,—,0.2,0,0
https://www.crunchbase.com//organization/gigalogy, Gigalogy ,Seed,We are building the future of E-Commerce. Our personalized product recommendation platform offers all you need to create stunning shopping experiences. Our goal is to recommend the right products  to the right person  at the right time., Artificial Intelligence  Blockchain  Internet  Software, Tokyo  Tokyo  Japan,We offer AI personalization with blockchain based reward management for E-Commerce businesses.,136 296,Jan 17  2020,Active,—, — , Asia-Pacific (APAC),—,—,For Profit, gigalogy.com/ ,https://www.facebook.com/gigalogy/,https://www.linkedin.com/company/gigalogy,https://twitter.com/gigalogy,info@gigalogy.com,0345007914,—, —,—,—, —, —, Artificial Intelligence  Data and Analytics  Internet Services  Other  Science and Engineering  Software,1, Mosleh Uddin,11-50,1,Seed,Feb 14  2022,¥48 608 000,¥48 608 000,Seed,¥48 608 000,¥48 608 000, — ,—,—,—, —,—,—,—,—,—,—,—,—,—,Private,—,—,—,—,—,—,—,—,—,8, — ,—,—,—,—,—,—,—,—,21,—,—,—,—,—,—,—,—,—,—,—,—,—,—,—, —,—,—,—,—,—,—,—,—,138 185,—,0,-0.1,-0.1
https://www.crunchbase.com//organization/alyc, Alyc ,Debt Financing,Alyc is focused on contextual  domain-specific  multi-modal voice systems. ALYC AI is able to mimic human interactions but thanks to our exceptional empathy programming  our holograms can converse even better than most humans can., Artificial Intelligence  B2B  Commercial  Software, Tokyo  Tokyo  Japan,Alyc is focused on contextual  domain-specific  multi-modal voice systems.,138 708,2018,Active,—, — , Asia-Pacific (APAC),—,—,For Profit, www.alyc.ai/ ,—,https://www.linkedin.com/company/alyc/,—,HELLO@ALYC.AI,707-404-3206,—, —,—,—, —, —, Artificial Intelligence  Data and Analytics  Other  Science and Engineering  Software,1, Fred Almeida,1-10,1,—,Dec 4  2019,$3 000 000,—,—,—,$3 000 000, — ,—,—,—, —,—,—,—,—,—,—,—,—,—,Private,—,—,—,—,—,—,—,—,—,3, — ,—,—,—,—,—,—,—,—,—,—,—,16,—,—,—,—,—,—,—,—,—,—,—,—, —,—,—,—,—,—,—,—,—,140 660,—,-0.1,-0.4,-0.3
https://www.crunchbase.com//organization/factorize, Factorize ,Pre-Seed,—, Apps  Artificial Intelligence  Developer Tools  Information Technology  Natural Language Processing  Software, Tokyo  Tokyo  Japan,Revolutionizing the digital landscape with AI-powered creativity.,139 268,2021,Active,—, — , Asia-Pacific (APAC),—,—,For Profit, factorize.ai ,https://www.facebook.com/factorizeteam,https://www.linkedin.com/company/factorizeinc,https://twitter.com/factorizeteam,hi@factorize.ai,—,—, —,—,—, —, —, Apps  Artificial Intelligence  Data and Analytics  Information Technology  Science and Engineering  Software,3, Alireza Goudarzi  Annie Koyama  Julien Hora,1-10,1,Seed,Sep 3  2022,$300 000,$300 000,Pre-Seed,$300 000,$300 000, — ,—,—,—, —,—,—,—,—,—,—,—,—,—,Private,—,—,—,—,—,—,—,—,—,7, — ,—,—,—,—,—,—,—,—,—,—,—,14,—,—,—,—,—,—,—,—,—,—,—,—, —,—,—,—,—,—,—,—,—,141 241,—,0.6,1,-0.3
https://www.crunchbase.com//organization/tocoton, Tocoton ,Venture - Series Unknown,"Toton is an image processing solution company specializing in image processing and AI.Free cropping ""webautoma""  ""Michieru"" based on image processing technology such as optimization of light source color temperature and automatic white balance correction  Windows cropping app ""Automa""  ""Kidoiraira"" that estimates emotions and age Ku  and a variety of development achievements such as ""organize photos"" that can have your own AI engine. You can try it for free.The AI ​​engine specialized in the image processing field is a TensorFlow-based AI engine. If you have any worries about whether you can improve the efficiency of image-related work  please do not hesitate to contact us.", Artificial Intelligence  Corporate Training  Education  Edutainment  Machine Learning  Software, Koriyama  Fukushima  Japan,Tocoton is an image processing solution company specializing in image processing and AI.,143 457,Jan 17  2012,Active,$1M to $10M, — , Asia-Pacific (APAC),—,—,For Profit, www.tocoton.co.jp ,—,—,—,—,—,—, —,—,—, —, —, Artificial Intelligence  Data and Analytics  Education  Media and Entertainment  Science and Engineering  Software,1, Junichi Arai,1-10,1,—,Mar 24  2016,¥10 000 000,¥10 000 000,Venture - Series Unknown,¥10 000 000,¥10 000 000, MAKOTO,1,1,—, —,—,—,—,—,—,—,—,—,—,Private,—,—,—,—,—,—,—,—,—,5, — ,—,—,—,—,—,—,—,—,—,—,—,18,—,—,—,—,—,—,—,—,—,—,—,—, —,—,—,—,—,—,—,—,—,145 543,—,-0.1,-0.1,1
https://www.crunchbase.com//organization/talentio, Talentio ,Venture - Series Unknown,"Talentio"" is a cloud HR service brand that uses state-of-the-art technology based on machine learning and big data analysis.", Machine Learning  Software, Tokyo  Tokyo  Japan,Talentio is provided  ta Planning and operation services.,145 388,2013,Active,—, — , Asia-Pacific (APAC),Mar 15  2017,—,For Profit, www.talentio.co.jp/ ,https://www.facebook.com/talentiocom,—,https://twitter.com/Talentio_ATS,—,—,—, —,—,—, —, —, Artificial Intelligence  Data and Analytics  Software,—, — ,1-10,1,M&A,May 8  2014,¥75 004 212,¥75 004 212,Venture - Series Unknown,¥75 004 212,¥75 004 212, CyberAgent Capital  ANRI,—,2,—, Was Acquired,—,—,—,—,—,—,—,—,—,Private,—,—,—,—,—,—,—,—,—,7, — ,—,—,—,—,—,—,—,—,—,—,—,—,494,—,0,104.13%,—,1,0%,100%,0%,6 321 877,-893 801,-12.39%, —,—,—, Talentio acquired by FreakOut Holdings , FreakOut Holdings ,Mar 15  2017,—,Acquisition,—,147 524,—,0.1,-0.2,-0.2
https://www.crunchbase.com//organization/plimes, PLIMES ,Seed,Healthcare  AI  Deep Learning  Dysphagia  Wearable device  IoT  Academia  Medicine  Engineering  and Nursing, Alternative Medicine  Artificial Intelligence  Beauty  Health Care  Industrial Engineering, Tsukuba  Ibaraki  Japan,PLIMES is a social welfare company  working to dramatically enhance user experience and social interaction for people with special needs.,147 235,Apr 18  2018,Active,—, — , Asia-Pacific (APAC),—,—,For Profit, www.plimes.com/ ,https://www.facebook.com/plimes/,https://www.linkedin.com/company/plimes/,—,info@plimes.com,—,—, —,—,—, —, —, Artificial Intelligence  Consumer Goods  Data and Analytics  Health Care  Manufacturing  Science and Engineering  Software,3, Atsushi Nitasaka  Dushyantha Jayatilake  Kenji Suzuki,1-10,1,Seed,Mar 24  2020,$1 400 000,$1 400 000,Seed,$1 400 000,$1 400 000, Cyberdyne,1,1,—, —,—,—,—,—,—,—,—,—,—,Private,—,—,—,—,—,—,—,—,—,7, — ,—,—,—,—,—,Medical Or Veterinary Science; Hygiene,0,2,—,—,—,—,—,—,—,—,—,—,—,—,—,—,—,—, —,—,—,—,—,—,—,—,—,149 421,—,0.7,-0.1,1.3
https://www.crunchbase.com//organization/farmers-support, Farmers Support ,Corporate Round,Farmers Support aims to solve the problems of farmers by utilizing technologies such as IoT and AI.Farmers Support provides IoT and artificial intelligence technology for farmers., Agriculture  Artificial Intelligence  Internet of Things, Kagoshima  Kagoshima  Japan,Farmers Support provides IoT and artificial intelligence technology for farmers.,148 522,2015,Active,—, — , Asia-Pacific (APAC),—,—,For Profit, farmers-s.co.jp/ ,—,—,—,info@farmers-s.co.jp,099-202-0610,—, —,—,—, —, —, Agriculture and Farming  Artificial Intelligence  Data and Analytics  Internet Services  Science and Engineering  Software,—, — ,1-10,1,—,Nov 15  2019,¥20 000 000,¥20 000 000,Corporate Round,¥20 000 000,¥20 000 000, Kagoshima Bank,1,1,—, —,—,—,—,—,—,—,—,—,—,Private,—,—,—,—,—,—,—,—,—,6, — ,—,—,—,—,—,—,—,—,—,—,—,14,—,—,—,—,—,—,—,—,—,—,—,—, —,—,—,—,—,—,—,—,—,150 739,—,-0.1,0.2,-0.2
