https://www.crunchbase.com//organization/camel-b76d, CAMEL ,—,—, Artificial Intelligence  Broadcasting  Content  Digital Media  Film Production  Video, Hyogo  Hokkaido  Japan,CAMEL provides AI development   Digital content production   CI/VI development   Illustration & Magazine production & Broadcasting services,423 094,May 1  1986,Active,Less than $1M, — , Asia-Pacific (APAC),—,—,For Profit, camel.co.jp/ ,https://www.facebook.com/camel45/,—,—,info@camel.co.jp,+81 796-24-6373,—, —,—,—, —, —, Artificial Intelligence  Data and Analytics  Media and Entertainment  Science and Engineering  Software  Video,—, — ,11-50,—,—,—,—,—,—,—,—, — ,—,—,—, —,—,—,—,—,—,—,—,—,—,Private,—,—,—,—,—,—,—,—,—,8, — ,—,—,—,—,—,—,—,—,—,—,11,6,—,—,—,—,—,—,—,—,—,—,—,—, —,—,—,—,—,—,—,—,—,435 629,—,0.3,3.5,2.2
https://www.crunchbase.com//organization/avinton, Avinton ,—,Avinton is a technology-focused  academically oriented  and independent IT  AI  and Big Data consultancy. It currently operates mainly in Japan  UK and Singapore. It clients range from small companies (50 ~ 100 employees) to Blue Chip multinationals as well as local Government. It is able to meet our client’s business requirements in a cost effective way through its constant research and extensive experience across multiple disciplines. It excels at designing and delivering bespoke solutions for complex problems through software solutions or changes in ways of working., Analytics  Artificial Intelligence  Big Data  Information Technology  Machine Learning  Software, Yokohama  Kanagawa  Japan,Avinton is a technology-focused  academically oriented  and independent IT  AI  and Big Data consultancy.,424 153,May 2010,Active,—, — , Asia-Pacific (APAC),—,—,For Profit, avinton.com/ ,https://www.facebook.com/Avintons/,https://www.linkedin.com/company/avinton/,https://twitter.com/AvintonJapan,jobs@avinton.com,+81 (0)3 5530 8976,1, —,—,—, —, —, Artificial Intelligence  Data and Analytics  Information Technology  Science and Engineering  Software,—, — ,101-250,—,—,—,—,—,—,—,—, — ,—,—,—, —,—,—,—,—,—,—,—,—,—,Private,—,—,—,—,—,—,—,—,—,8, — ,—,—,—,—,—,—,—,—,—,—,—,49,45 576,25 775.5,352,627.82%,1 113.79%,1.46,35.53%,79.16%,-17.66%,719 469,-1 559 309,-68.43%, Operations  Sales,5,—,—,—,—,—,—,—,436 719,—,-0.2,3.3,3.3
https://www.crunchbase.com//organization/rimo, RIMO ,—,—, Apps  Artificial Intelligence  Machine Learning  Service Industry, Akasaka  Tokyo  Japan,RIMO provides automatic transcription services using artificial intelligence.,425 554,Oct 1  2019,Active,—, — , Asia-Pacific (APAC),—,—,For Profit, rimo.app/ ,—,—,—,support@rimo.app,—,—, —,—,—, —, —, Apps  Artificial Intelligence  Data and Analytics  Other  Science and Engineering  Software,—, — ,11-50,—,—,—,—,—,—,—,—, — ,—,—,—, —,—,—,—,—,—,—,—,—,—,Private,—,—,—,—,—,—,—,—,—,3, — ,—,—,—,—,—,—,—,—,—,—,—,12,89 019,35 570,498,835.76%,2 271.43%,1.63,49.23%,46.18%,-49.19%,437 754,-1 364 767,-75.71%, —,—,—,—,—,—,—,—,—,438 164,—,-0.4,-0.2,4.4
https://www.crunchbase.com//organization/intelligent-technology, Intelligent Technology ,—,—, Artificial Intelligence  Information Technology  Machine Learning  Software, Yokohama-shi  Kanagawa  Japan,Intelligent Technology is a research and development group of artificial intelligence software technology.,427 782,Jan 16  1985,Active,$10M to $50M, — , Asia-Pacific (APAC),—,—,For Profit, www.iti.co.jp/ ,—,https://www.linkedin.com/company/%EF%BC%88%E6%A0%AA%EF%BC%89%E3%82%A4%E3%83%B3%E3%83%86%E3%83%AA%E3%82%B8%E3%82%A7%E3%83%B3%E3%83%88%E3%83%86%E3%82%AF%E3%83%8E%E3%83%AD%E3%82%B8%E3%83%BC,—,—,045-335-3981,1, —,—,—, —, —, Artificial Intelligence  Data and Analytics  Information Technology  Science and Engineering  Software,—, — ,51-100,—,—,—,—,—,—,—,—, — ,—,—,—, —,—,—,—,—,—,—,—,—,—,Private,—,—,—,—,—,—,—,—,—,23, — ,—,—,—,—,—,—,—,—,—,43,1,17,7 749,—,0,—,—,1,—,100%,—,2 159 000,—,—, —,—,—,—,—,—,—,—,—,440 466,—,-0.1,1.8,5.8
https://www.crunchbase.com//organization/gdep-solutions, GDEP Solutions ,—,—, Artificial Intelligence  Cloud Infrastructure  Computer  Hardware  Machine Learning  Software, Hongo  Tokyo  Japan,GDEP Solutions provide hardware centered on GPU  construction of AI system  and solutions.,431 287,Jan 15  2016,Active,—, — , Asia-Pacific (APAC),—,—,For Profit, www.gdep-sol.co.jp/ ,—,—,https://www.twitter.com/GDEPsolutions,—,03-5802-7050,—, —,—,—, —, —, Artificial Intelligence  Consumer Electronics  Data and Analytics  Hardware  Internet Services  Science and Engineering  Software,1, Atsushi Nagasaki,—,—,—,—,—,—,—,—,—, — ,—,—,—, —,—,—,—,—,—,—,—,—,—,Private,—,—,—,—,—,—,—,—,—,9, — ,—,—,—,—,—,—,—,—,—,—,—,17,1 197,18 724.67,57,-85.48%,32.2%,1.33,33.33%,66.67%,-33.33%,4 809 075,2 880 032,149.3%, —,—,—,—,—,—,—,—,—,444 079,—,-0.4,-0.2,1.9
https://www.crunchbase.com//organization/aiq-879c, aiQ ,—,—, Analytics  Artificial Intelligence  Big Data  Data Mining  Finance  Financial Services  FinTech  Machine Learning  Software, Tokyo  Tokyo  Japan,aiQ offers AI technology and Big Data analysis using many Machine Learning techniques  Analysis experience in the Financial Industry.,431 372,Jun 22  2018,Active,—, — , Asia-Pacific (APAC),—,—,For Profit, www.aiq-index.com/ ,https://www.facebook.com/aiq.index/,https://www.linkedin.com/company/aiq-index/,—,—,—,—, —,—,—, —, —, Artificial Intelligence  Data and Analytics  Financial Services  Information Technology  Science and Engineering  Software,1, Hiroki Yamamoto,—,—,—,—,—,—,—,—,—, — ,—,—,—, —,—,—,—,—,—,—,—,—,—,Private,—,—,—,—,—,—,—,—,—,11, — ,—,—,—,—,—,—,—,—,—,—,—,28,—,—,—,—,—,—,—,—,—,—,—,—, —,—,—,—,—,—,—,—,—,444 165,—,-0.1,-0.4,-0.1
https://www.crunchbase.com//organization/alt-f8d3, alt ,Venture - Series Unknown,—, Artificial Intelligence  IT Infrastructure  SaaS, Roppongi  Tokyo  Japan,alt is a technology company that develops personal AI  SaaS  and infrastructure solutions to create lasting value in human life.,431 529,Nov 2014,Active,$1M to $10M, — , Asia-Pacific (APAC),—,—,For Profit, alt.ai ,https://www.facebook.com/alt.ai.inc,https://www.linkedin.com/company/alt-ai,https://www.twitter.com/alt_inc_clone,info@alt.ai,+81-3-63807076,—, —,—,—, —, —, Artificial Intelligence  Data and Analytics  Information Technology  Science and Engineering  Software,—, — ,11-50,1,—,Jun 1  2022,—,—,Venture - Series Unknown,—,—, Spiral Capital,—,1,—, —,—,—,—,—,—,—,—,—,—,Private,—,—,—,—,—,—,—,—,—,9, — ,—,—,—,—,—,—,—,—,—,13 210,4,—,40 652,22 048,392,250.09%,3 463.64%,1.99,18.04%,59.88%,92.66%,782 552,-823 888,-51.29%, —,—,—,—,—,—,—,—,—,444 324,—,0.4,-0.5,-0.3
https://www.crunchbase.com//organization/airfriend, Airfriend ,—,—, Apps  Artificial Intelligence  Software, Shibuya  Kanagawa  Japan,Airfriend is a creator of the artificial intelligence training application that is aimed for the recreation of its users.,432 195,Nov 2  2021,Active,—, — , Asia-Pacific (APAC),—,—,For Profit, airfriend.ai/ ,https://www.facebook.com/airfriendai,—,https://twitter.com/airfriendai,—,—,—, —,—,—, —, —, Apps  Artificial Intelligence  Data and Analytics  Science and Engineering  Software,—, — ,—,—,—,—,—,—,—,—,—, — ,—,—,—, —,—,—,—,—,—,—,—,—,—,Private,—,—,—,—,—,—,—,—,—,11, — ,—,—,—,—,—,—,—,—,—,—,—,7,69 245,75 390.17,52,43.13%,-48.69%,1.22,22.38%,77.62%,-22.38%,530 931,-82 885,-13.5%, —,—,—,—,—,—,—,—,—,445 008,—,-0.1,1.7,3.9
https://www.crunchbase.com//organization/ntt-technocross, NTT TechnoCross ,—,NTT TechnoCross is an internet-based company that provides AI-driven solutions. Its flagship product  ForeSight Voice Mining is an AI-based contact center analytics that leverages NTT's award-winning speech recognition and patented emotion analysis technologies. ForeSight takes agent training and support to new heights increases sales and operational and sales efficiency and gives you insights for a better customer experience. Foresight transforms contact centers into customer engagement centers through real-time agent support and call monitoring as well as quantitative and objective analysis of massive call data. More than 26 000 agents at 500 contact centers are proudly providing superior customer experience with ForeSight Voice Mining., Artificial Intelligence  Big Data  Internet of Things  Software, Minato  Chiba  Japan,NTT TechnoCross is an internet-based company that provides AI-driven solutions.,432 384,Jul 2  1985,Active,—, — , Asia-Pacific (APAC),—,—,For Profit, www.ntt-tx.co.jp/ ,—,https://www.linkedin.com/company/ntt-technocross,—,—,—,1, —,—,—, —, —, Artificial Intelligence  Data and Analytics  Internet Services  Science and Engineering  Software,—, — ,1001-5000,—,—,—,—,—,—,—,—, — ,—,—,—, —,1,2,2,—,1,1,—,—,—,Private,—,—,—,—,—,—,—,—,—,11, — ,—,—,—,—,Scientific and electric apparatus and instruments,Electric Communication Technique,6,26,4,—,—,14,399,10 830.17,17,-96.62%,5 486.49%,2,100%,0%,140.62%,6 967 570,5 374 373,337.33%, —,—,—,—,—,—,—,—,—,445 205,—,-0.1,-0.1,2.5
https://www.crunchbase.com//organization/comture, COMTURE ,Venture - Series Unknown,COMTURE is a provider of Cloud  Big data  AI  IoT  Business system construction  ERP  Fintech  and Infrastructure construction solutions. The company was founded in January 1985 and is based in Shinagawa  Tokyo  Japan., Artificial Intelligence  Big Data  Cloud Data Services  FinTech  Software, Tokyo  Tokyo  Japan,COMTURE is a provider of Cloud  Big data  AI  IoT  Business system construction  ERP  Fintech  and Infrastructure construction solutions.,434 645,Jan 18  1985,Active,—, — , Asia-Pacific (APAC),Feb 26  2010,—,For Profit, www.comture.com/ ,—,https://www.linkedin.com/company/comture-corp,https://twitter.com/comture_n16,—,03-5745-9700,—, —,—,—, —, —, Artificial Intelligence  Data and Analytics  Financial Services  Information Technology  Internet Services  Science and Engineering  Software,2, Ono Ken  Shinichi Inoue,1001-5000,1,IPO,Apr 12  2002,¥15 000 000,¥15 000 000,Venture - Series Unknown,¥15 000 000,¥15 000 000, TIS Japan  NTT DATA Getronics Corp.,—,2,1, Made Acquisitions,2,2,—,—,—,—,—,—,—,Public,Feb 26  2010,—,—,—, 3844 ,TYO - Tokyo Stock Exchange,—,—,—,3, — ,—,—,—,—,—,—,—,—,—,—,—,37,14 678,50 334.33,30,-55.8%,76.47%,2.91,54.28%,0%,200.17%,1 554 635,714 885,85.13%, —,—,—,—,—,—,—,—,—,447 531,—,1.9,-0.7,-0.1
https://www.crunchbase.com//organization/evoke-music, Evoke Music ,—,—, Artificial Intelligence  Machine Learning  Music, Tokyo  Tokyo  Japan,Evoke Music is an AI-powered music library that offers services for personal  business  and enterprise industries.,437 812,Dec 2019,Active,—, — , Asia-Pacific (APAC),—,—,For Profit, evokemusic.ai ,https://www.facebook.com/EvokeMusicAI,https://www.linkedin.com/company/evoke-music,https://twitter.com/evokemusicai,support@evokemusic.ai,—,1, —,—,—, —, —, Artificial Intelligence  Data and Analytics  Media and Entertainment  Music and Audio  Science and Engineering  Software,1, Taishi Fukuyama,1-10,—,—,—,—,—,—,—,—, — ,—,—,—, —,—,—,—,—,—,—,—,—,—,Private,—,—,—,—,—,—,—,—,—,6, — ,—,—,—,—,—,—,—,—,—,—,—,20,20 408,43 571.5,84,-43.89%,-72.64%,2.52,68.15%,38.01%,-52.53%,1 250 671,492 943,65.06%, —,—,—,—,—,—,—,—,—,450 798,—,0.5,0.5,1.4
https://www.crunchbase.com//organization/bitgrit, bitgrit ,—,At bitgrit  we specialize in improving business indicators through artificial intelligence. We connect data scientists directly to industry problems  facilitating ecosystems to share the brainpower for building AI., Artificial Intelligence  Information Technology  Machine Learning  Software, Tokyo  Tokyo  Japan,Democratic AI,439 644,Nov 2017,Active,—, — , Asia-Pacific (APAC),—,—,For Profit, bitgrit.net ,—,https://www.linkedin.com/company/bitgrit,—,—,—,1, —,—,—, —, —, Artificial Intelligence  Data and Analytics  Information Technology  Science and Engineering  Software,1, Tetsuro Masunaga,11-50,—,—,—,—,—,—,—,—, — ,—,—,—, —,—,—,—,—,—,—,—,—,—,Private,—,—,—,—,—,—,—,—,—,7, — ,—,—,—,—,Advertising; business,Computing; Calculating,2,2,—,—,—,35,1 227,3 677.17,1 842,184.69%,1 392.31%,7.71,670.58%,54.28%,-45.72%,4 765 404,-1 648 874,-25.71%, —,—,—,—,—,—,—,—,—,452 691,—,-0.4,-0.5,-0.8
https://www.crunchbase.com//organization/sciseed, Sciseed ,—,Sciseed is an AI business and human resources business. Sciseed Co.  Ltd.'s mission is to provide value through advanced technology and business design., Artificial Intelligence  Bioinformatics  Biometrics  Machine Learning, Tokyo  Tokyo  Japan,Sciseed is an AI business and human resources business.,440 833,Apr 2015,Active,—, — , Asia-Pacific (APAC),Apr 21  2023,—,For Profit, www.sciseed.jp/ ,https://www.facebook.com/Sciseed.jp,—,—,info@sciseed.jp,+81 3-6871-8691,—, —,—,—, —, —, Artificial Intelligence  Biotechnology  Data and Analytics  Science and Engineering  Software,1, Yoji Nakamura,11-50,—,M&A,—,—,—,—,—,—, — ,—,—,—, Was Acquired,—,—,—,—,—,—,—,—,—,Private,—,—,—,—,—,—,—,—,—,7, — ,—,—,—,—,—,—,0,0,—,—,1,55,2 083 242,758 938.67,1 536,343.29%,50.88%,1.5,30.79%,75.63%,-13.58%,39 331,-71 381,-64.47%, —,—,—, Sciseed acquired by Hayate Investment , Hayate Investment ,Apr 21  2023,—,Acquisition,—,453 911,—,-0.3,-0.3,-0.3
https://www.crunchbase.com//organization/mitech, MITech ,—,MITech specializes in applied machine learning and developed machine learning algorithms. The company utilizes image features and machine learning methods. The company develops and implements machine learning algorithms and then apply the newest AI technologies into practice.MITech was established on 2018 and is headquartered in Fuchu  Japan., Artificial Intelligence  Embedded Systems  Image Recognition  Machine Learning  Software, Fuchu  Tokyo  Japan,MITech specializes in applied machine learning and developed machine learning algorithms.,441 902,2018,Active,—, — , Asia-Pacific (APAC),—,—,For Profit, mitech.jp ,—,https://www.linkedin.com/company/mitechcorp,—,—,—,10, —,—,—, —, —, Artificial Intelligence  Data and Analytics  Hardware  Science and Engineering  Software,—, — ,—,—,—,—,—,—,—,—,—, — ,—,—,—, —,—,—,—,—,—,—,—,—,—,Private,—,—,—,—,—,—,1,—,—,7, — ,—,—,—,—,—,—,—,—,—,—,—,22,18 486,—,80,57.93%,-55.56%,3.67,-54.17%,0%,—,1 324 294,-276 251,-17.26%, —,—,—,—,—,—,—,—,—,455 015,—,2.9,-0.3,2.1
https://www.crunchbase.com//organization/levtech-co, Levtech Co ,—,—, Intelligent Systems  Recruiting, Shibuya  Kanagawa  Japan,Levtech Co specializes in freelance and engineers creators of IT · Web area to support the Career.,443 034,2017,Active,—, — , Asia-Pacific (APAC),—,—,For Profit, levtech.jp/ ,—,https://www.linkedin.com/company/レバテック株式会社,—,—,—,—, —,—,—, —, —, Artificial Intelligence  Data and Analytics  Professional Services  Science and Engineering,1, Tomohide Iwatsuki,—,—,—,—,—,—,—,—,—, — ,—,—,—, —,—,—,—,—,—,—,—,—,—,Private,—,—,—,—,—,—,—,—,—,—, — ,—,—,—,—,—,—,—,—,—,—,—,52,1 670 737,1 084 633.67,1 134,44.22%,187.09%,2.04,18.86%,63.58%,-19.02%,47 075,-7 964,-14.47%, —,—,—,—,—,—,—,—,—,456 172,—,-0.4,-0.2,2.8
https://www.crunchbase.com//organization/stathack, StatHack ,Seed,StatHack provides AI solutions that solve problems through effective use of data and further improve customer results. They will provide consulting at the stage of considering the introduction of AI technology for development  introduction  and operation support., Artificial Intelligence  Consulting  Data Integration  IT Infrastructure, Tokyo  Tokyo  Japan,StatHack is an IT consulting firm that provides AI solutions  data analysis  image classification  AI development  and operation support.,443 808,Aug 25  2021,Active,—, — , Asia-Pacific (APAC),—,—,For Profit, www.stathack.jp/ ,—,—,—,—,—,—, —,—,—, —, —, Artificial Intelligence  Data and Analytics  Information Technology  Professional Services  Science and Engineering  Software,—, — ,—,1,Seed,Dec 1  2021,—,—,Seed,—,—, Deep30,—,1,—, —,—,—,—,—,—,—,—,—,—,Private,—,—,—,—,—,—,—,—,—,12, — ,—,—,—,—,—,—,—,—,—,—,—,23,9 956,—,0,—,—,1,—,100%,—,1 902 893,—,—, —,—,—,—,—,—,—,—,—,456 962,—,0.2,1.4,5.8
https://www.crunchbase.com//organization/lightblue-technology, Lightblue Technology ,Corporate Round,Lightblue Technology is an AI startup established mainly by students from the University of Tokyo and applies cutting-edge machine learning research results and technology researched in academic fields to business to solve social issues.The company was founded in 2018 and based in Tokyo  Japan., Artificial Intelligence  Content  Machine Learning  Marketing  Software  Task Management, Tokyo  Tokyo  Japan,Lightblue Technology is an AI startup that uses machine learning to expand and optimize a business.,448 072,Jan 1  2018,Active,—, — , Asia-Pacific (APAC),—,—,For Profit, www.lightblue-tech.com/ ,https://www.facebook.com/profile.php?id=100057165771812,https://www.linkedin.com/company/lightblue-tech,https://twitter.com/lightblue_tech,office@lightblue-tech.com,03-6801-8990,—, —,—,—, —, —, Artificial Intelligence  Data and Analytics  Media and Entertainment  Sales and Marketing  Science and Engineering  Software,1, Takuma Watanabe,11-50,1,—,Oct 31  2018,—,—,Corporate Round,—,—, GAUSS Japan  DIP Corporation,—,2,—, —,1,1,1,—,—,—,—,—,—,Private,—,—,—,—,—,—,—,—,—,15, — ,—,—,—,—,—,—,—,—,—,—,1,22,—,—,—,—,—,—,—,—,—,—,—,—, —,—,—,—,—,—,—,—,—,461 359,—,0.8,1.3,-0.2
https://www.crunchbase.com//organization/emc-healthcare-22ac, EMC Healthcare ,—,—, Artificial Intelligence  Business Development  Health Care, Otemachi  Tokyo  Japan,EMC Healthcare provides management strategy  healthcare  data science  AI and business development services.,455 253,Feb 1  2017,Active,—, — , Asia-Pacific (APAC),—,—,For Profit, www.emcjpn.com/ ,—,—,—,—,03-4580-2500,—, —,—,—, —, —, Artificial Intelligence  Data and Analytics  Health Care  Professional Services  Science and Engineering  Software,—, — ,11-50,—,—,—,—,—,—,—,—, — ,—,—,—, —,—,—,—,—,—,—,—,—,—,Private,—,—,—,—,—,—,—,—,—,4, — ,—,—,—,—,—,—,—,—,—,—,4,19,—,—,—,—,—,—,—,—,—,—,—,—, —,—,—,—,—,—,—,—,—,468 745,—,0.1,0,-0.1
https://www.crunchbase.com//organization/estyle-6cf6, Estyle ,—,—, Artificial Intelligence  Blockchain  Drones  Information Technology  Internet of Things  Machine Learning  Software, Tokyo  Tokyo  Japan,Estyle is developing its business centered on media related to AI and machine learning.,460 318,Jul 2006,Active,—, — , Asia-Pacific (APAC),—,—,For Profit, estyle-inc.jp/ ,—,—,https://twitter.com/estyle_naga,Johrenk7@gmail.com,—,—, —,—,—, —, —, Artificial Intelligence  Consumer Electronics  Consumer Goods  Data and Analytics  Hardware  Information Technology  Internet Services  Other  Science and Engineering  Software,1, Tomoyuki Miyahara,11-50,—,—,—,—,—,—,—,—, — ,—,—,1, Made Acquisitions,—,—,—,—,—,—,—,—,—,Private,—,—,—,—,—,—,—,—,—,23, — ,—,—,—,—,—,—,—,—,—,—,7,6,—,—,—,—,—,—,—,—,—,—,—,—, —,—,—,—,—,—,—,—,—,473 963,—,-0.3,-0.2,-0.1
https://www.crunchbase.com//organization/tanaka-ai, Tanaka Ai ,—,Domestic sale and import/export of chemicals for the chemical industry  petrochemical products  dyes  pigments  rubber products  oil and fat products  synthetic resins and molded products  nonferrous metals  elevators  etc., Artificial Intelligence  Chemical  Oil and Gas  Sales  Wholesale, Kurume  Fukuoka  Japan,Tanaka Ai provides domestic sale and import/export of chemicals for the chemical industry.,460 561,Jul 1  1948,Active,—, — , Asia-Pacific (APAC),—,—,For Profit, tanakaai.co.jp/ ,—,—,—,—,81-942-32-6331,—, —,—,—, —, —, Artificial Intelligence  Commerce and Shopping  Data and Analytics  Energy  Natural Resources  Sales and Marketing  Science and Engineering  Software,—, — ,101-250,—,—,—,—,—,—,—,—, — ,—,—,—, —,1,2,—,—,—,—,—,—,—,Private,—,—,—,—,—,—,—,—,—,8, — ,—,—,—,—,—,—,—,—,—,—,—,4,—,—,—,—,—,—,—,—,—,—,—,—, —,—,—,—,—,—,—,—,—,474 210,—,0,-0.2,4
https://www.crunchbase.com//organization/contronym, Contronym ,—,—, Artificial Intelligence  Information Technology  Software, Tokyo  Tokyo  Japan,Contronym is an Information Technology company that specializes in Artificial Intelligence and metaverse.,460 737,—,Active,—, — , Asia-Pacific (APAC),—,—,For Profit, contronym.jp/ ,—,—,—,—,—,—, —,—,—, —, —, Artificial Intelligence  Data and Analytics  Information Technology  Science and Engineering  Software,—, — ,—,—,—,—,—,—,—,—,—, — ,—,—,—, —,—,—,—,—,—,—,—,—,—,Private,—,—,—,—,—,—,—,—,—,23, — ,—,—,—,—,—,—,—,—,—,—,—,2,—,—,—,—,—,—,—,—,—,—,—,—, —,—,—,—,—,—,—,—,—,474 394,—,-0.4,-0.6,-0.7
https://www.crunchbase.com//organization/quando, QUANDO ,Venture - Series Unknown,—, Artificial Intelligence  Finance  Task Management, Kitakyushu  Fukuoka  Japan,Quando is an Business development company utilizing IoT / AI,462 599,Apr 25  2017,Active,—, — , Asia-Pacific (APAC),—,—,For Profit, quando.jp/ ,https://www.facebook.com/QUANDOInc/,—,—,—,—,—, —,—,—, —, —, Artificial Intelligence  Data and Analytics  Financial Services  Science and Engineering  Software,2, Junichiro Shimooka  Masatoshi Nakano,11-50,1,—,Mar 31  2021,—,—,Venture - Series Unknown,—,—, G-STARTUP,—,1,—, —,—,—,—,—,—,—,—,—,—,Private,—,—,—,—,—,—,—,—,—,1, — ,—,—,—,—,—,—,—,—,—,—,1,7,22 563,—,0,—,—,1,—,100%,—,1 186 976,—,—, —,—,—,—,—,—,—,—,—,476 294,—,1.4,2.2,0
https://www.crunchbase.com//organization/equmenopolis, Equmenopolis ,—,—, Artificial Intelligence  Information Services  Software, Tokyo  Tokyo  Japan,Equmenopolis is a information services company that specializes in conversational AI agent platforms and application developments.,464 477,May 2022,Active,—, — , Asia-Pacific (APAC),—,—,For Profit, www.equ.ai/ ,—,https://www.linkedin.com/company/equmenopolis/,https://twitter.com/equmenopolis,—,—,—, —,—,—, —, —, Artificial Intelligence  Data and Analytics  Information Technology  Science and Engineering  Software,1, Yoichi Matsuyama,11-50,—,—,—,—,—,—,—,—, — ,—,—,—, —,—,—,—,—,—,—,—,—,—,Private,—,—,—,—,—,—,—,—,—,15, — ,—,—,—,—,—,—,—,—,—,—,—,4,—,—,—,—,—,—,—,—,—,—,—,—, —,—,—,—,—,—,—,—,—,478 229,—,-0.4,-0.3,-0.1
https://www.crunchbase.com//organization/odd-no, ODD No. ,—,—, Artificial Intelligence  Gaming  Information Technology, Tokyo  Tokyo  Japan,ODD No. specializes in development of original IP  game  artificial inteligence  music and content.,471 331,Mar 14  2022,Active,—, — , Asia-Pacific (APAC),—,—,For Profit, odd-no.com/ ,—,—,—,—,—,—, —,—,—, —, —, Artificial Intelligence  Data and Analytics  Gaming  Information Technology  Science and Engineering  Software,—, — ,—,—,—,—,—,—,—,—,—, — ,—,—,—, —,—,—,—,—,—,—,—,—,—,Private,—,—,—,—,—,—,—,—,—,11, — ,—,—,—,—,—,—,—,—,—,—,—,14,—,—,—,—,—,—,—,—,—,—,—,—, —,—,—,—,—,—,—,—,—,485 302,—,1.2,2.9,1.8
